recipes_id, recipes_name, recipes_time_to_completion, recipes_meal_type, recipes_reviews, recipes_nutrition, recipes_ingredients, recipes_directions
admin1, Simple Waffles, 30 min, Breakfast, null, 382 calories, 
    Waffle Iron 2 eggs 2 cups of flour 1 1/3 cup of milk 1/2 cup of vegatable oil 1 tablespoon white sugar 4 teaspoons baking powder 1/4 teaspoon salt 1/2 teaspoon vanilla extract nonstick cooking spray, Preheat a waffle iron Whisk eggs in a large bowl until light and fluffy. Add flour milk and vegetable oil and mix to combine. Whisk in sugar then mix in baking powder salt and vanilla just until smooth Spray the preheated waffle iron with nonstick spray. Pour batter onto the hot waffle iron and cook until golden brown and the iron stops steaming. 3 to 5 minutes.
admin2, Classic Hash Browns, 30 min, Breakfast, null, 334 calories, 
    2 peeled potatoes 3 tablespoons of butter (1 pinch of cayenne pepper and 1 pinch of paprika) salt and pepper, Shred potatoes into a large bowl filled with cold water. Stir until water is cloudy; drain and cover potatoes again with fresh cold water. Stir again to dissolve excess starch. Drain potatoes well and pat dry with paper towels squeeze out any excess moisture. Heat clarified butter in a large nonstick pan over medium heat. Sprinkle shredded potatoes into hot butter in an even layer. Season with cayenne pepper paprika salt and black pepper. Cook potatoes until a brown crust forms on the bottom(5 minutes). Flip or stir and continue to cook until potatoes are browned and crusty all over. About 5 more minutes.
admin3, Microwave Scrambled Eggs, 10 min, Breakfast, null, 141 calories, 
    4 eggs 1/4 cup milk 1/8 teaspoon salt, Gather ingredients. Break the eggs into a microwave-proof mixing bowl. Add milk and salt and mix well Pop the bowl into the microwave and cook on high power for 30 seconds. Remove bowl and beat eggs very well scraping down the sides of the bowl and return to the microwave for another 30 seconds.
admin4, Homemade Breakfast Sausage, 20 min, Breakfast, null, 409 calories, 
    1 tablespoon brown sugar 2 teaspoons dried sgfe 2 teaspoons salt 1 teaspoon ground black pepper 1/4 teaspoon dried marjoram 1/8 teaspoon crushed red pepper flakes 1 pinch ground clothes 2 lbs ground pork, Gather ingredients Mix together brown sugar sage salt black pepper marjoram red pepper flakes and cloves in a small bowl until well combined. Place pork in a large bowl. Add spice mixture and mix with your hands until well combined. Form mixture into 6 patties. Heat a large skillet over medium-high heat. Add patties and saute until browned and crispy about 5 minutes per side. An instant-read thermometer inserted into the center should read at least 160 degrees F.